{
  "schema_version": "1.0.0",
  "provenance": {
    "generated_at": "2026-08-04T09:15:00Z",
    "git": {
      "commit": "aaaaaaaaaaaaaaaaaaaaaaaaaaaaaaaaaaaaaaaa",
      "dirty": false
    },
    "machine": {
      "platform": "Darwin",
      "arch": "arm64",
      "cpus": 12,
      "python": "3.14.3",
      "node": "26.3.0",
      "go": "1.26.5"
    },
    "run": {
      "mode": "local",
      "base": "http://127.0.0.1:18099",
      "sample_sizes": {
        "tier1_playwright": 12,
        "tier4_synthetic_linear": 100
      },
      "seed": null
    }
  },
  "detection": {
    "tier4_synthetic_linear": {
      "n": 100,
      "detected": 100,
      "rate": 1.0,
      "ci_low": 0.963,
      "ci_high": 1.0,
      "mean_score": 0.98,
      "mean_confidence": 0.72
    }
  },
  "false_positive_rate": null,
  "session": {
    "cold_start": {
      "n": 5,
      "score": 0.0,
      "confidence": 0.1,
      "decisions": [
        "allow"
      ],
      "reasons": [
        "INSUFFICIENT_EVIDENCE"
      ],
      "never_blocks": true
    },
    "ttcd": {
      "challenge": {
        "reached": 30,
        "of": 30,
        "batches": 1,
        "events": 28,
        "seconds": 1.3
      },
      "block": {
        "reached": 30,
        "of": 30,
        "batches": 2,
        "events": 56,
        "seconds": 3.3
      }
    },
    "latency": {
      "n": 500,
      "p50": 2.199,
      "p95": 3.1,
      "p99": 4.2,
      "max": 9.8,
      "budget_ms": 80
    }
  },
  "architecture": [
    {
      "architecture": "maintained",
      "sessions": 100,
      "duration_s": 10,
      "batches_per_session": 5,
      "heap_mb": 1.2,
      "bytes_per_session": 4096,
      "decide_p50_ms": 0.01,
      "decide_p99_ms": 0.04,
      "decide_max_ms": 0.9
    }
  ],
  "absent_tiers": []
}
